{
  "$schema": "../../schemas/v1.7.1-energy-qualification-plan.schema.json",
  "schemaVersion": 1,
  "planId": "goreecloud.glaze.v1.7.1.energy-behavior-qualification",
  "name": "Glaze V1.7.1 Retained Energy-Behavior Qualification Plan",
  "lifecycle": "DevelopmentQualification",
  "successorReleaseLine": "1.7.1",
  "developmentIdentity": "1.7.1-dev.1",
  "sourceRevision": "4b9d085a5177b96cc31d4270b38d792a59872e37",
  "sourceModelVersion": "1.7.0-dev.47",
  "acceptanceModelVersion": "1.7.0-dev.39",
  "stableBaseline": "1.7.0",
  "historicalSourceStableBaseline": "1.6.0",
  "consumerEligible": false,
  "laneId": "energy-behavior",
  "conditional": true,
  "evidenceType": "energy",
  "otherRequiredGroups": [
    "device"
  ],
  "retainedOtherGroupsAlreadyPresent": false,
  "authority": {
    "acceptanceModel": "contracts/v1.7/acceptance.dev.json",
    "performanceEnergyAwareness": "contracts/v1.7/performance-energy-awareness.dev.json",
    "motionPerformance": "contracts/v1.7/motion-performance.dev.json",
    "acceptanceRecord": "acceptance/v1.7-development.md",
    "systemMotionStandard": "GoreeCloud Standard \u2014 System-Wide Motion Continuity and Performance",
    "performanceBudget": "GoreeCloud \u2014 Standard \u2014 Glaze UI Performance Budget v1.0"
  },
  "record": {
    "manualExecutionRequired": true,
    "physicalDeviceRequired": true,
    "emulatorOrSimulatorProhibited": true,
    "placeholderValuesProhibited": true,
    "sourceRevisionFormat": "40-lowercase-hex",
    "toolingRevisionFormat": "40-lowercase-hex",
    "integrationRevisionFormat": "40-lowercase-hex",
    "repository": "GoreeCloud/glaze",
    "allowedMeasurementMethods": [
      "external-power-meter",
      "platform-energy-instrument",
      "battery-energy-counter",
      "battery-charge-counter",
      "platform-power-profiler",
      "other-direct-quantitative"
    ],
    "requiredScenarioIds": [
      "source-and-build-identity",
      "controlled-idle-baseline",
      "foreground-representative-workload",
      "constrained-or-low-power-workload",
      "background-offscreen-lifecycle",
      "thermal-and-resource-recovery",
      "authority-and-task-integrity"
    ],
    "measurementDecisionValues": [
      "review-required",
      "measurement-blocked"
    ]
  },
  "measurementRules": {
    "samePhysicalDeviceAcrossScenarios": true,
    "sameIntegrationBuildAcrossScenarios": true,
    "sameMeasurementMethodAcrossMeasuredScenarios": true,
    "directQuantitativeEnergyOrPowerMeasurementRequired": true,
    "batteryPercentageAloneIsEnergyEvidence": false,
    "thermalStateAloneIsEnergyEvidence": false,
    "cpuGpuUtilizationAloneIsEnergyEvidence": false,
    "controlledIdleRequired": true,
    "foregroundRepresentativeWorkloadRequired": true,
    "constrainedOrLowPowerRequired": true,
    "backgroundOrOffscreenRequired": true,
    "thermalAndResourceRecoveryRequired": true,
    "reviewerMustAssessAgainstGoverningStandards": true,
    "numericEnergyAcceptanceThresholdDefined": false,
    "protocolMayInventAcceptanceThreshold": false,
    "minimumEnergyScenarioDurationSeconds": 30,
    "sameSessionComparativeScenariosRequired": true,
    "platformEnergyUnitsComparableOnlyWithinSameToolSession": true,
    "accessibilityAndReducedMotionIntegrityRequired": true,
    "measurementLimitationsRequired": true
  },
  "acceptanceRules": {
    "operatorIdentityRequired": true,
    "integrationBuildIdentityRequired": true,
    "realPhysicalDeviceRequired": true,
    "directQuantitativeMeasurementRequired": true,
    "batteryPercentOnlyRecordAccepted": false,
    "emulatorOrSimulatorIsEnergyEvidence": false,
    "hostedCiIsEnergyEvidence": false,
    "energyRecordMayClaimDeviceEvidence": false,
    "energyRecordMayClaimPerformanceEvidence": false,
    "energyRecordMayClaimHumanEvidence": false,
    "measurementRecordPassImpliesEnergyAccepted": false,
    "measurementRecordPassImpliesLaneClosed": false,
    "protocolValidationImpliesEnergyEvidence": false,
    "protocolValidationImpliesSection48Acceptance": false,
    "protocolValidationImpliesV171Acceptance": false,
    "protocolValidationImpliesLifecyclePromotion": false,
    "protocolValidationImpliesConsumerAcceptance": false,
    "protocolValidationImpliesDeploymentAcceptance": false,
    "protocolValidationImpliesPublication": false,
    "protocolValidationImpliesProductionAcceptance": false
  },
  "implementation": {
    "validator": "scripts/validate_glaze_v1_7_1_energy_qualification.py",
    "workflow": ".github/workflows/glaze-v1.7.1-energy-qualification-control.yml",
    "humanProcedure": "acceptance/v1.7.1-energy-qualification.md",
    "recordTemplate": "acceptance/v1.7.1-energy-evidence.template.json",
    "preparationHelper": "scripts/prepare_glaze_v1_7_1_energy_qualification.py"
  },
  "currentBoundary": {
    "protocolEstablished": true,
    "energyEvidenceEstablished": false,
    "deviceEvidenceEstablishedByThisControl": false,
    "performanceEvidenceEstablished": false,
    "section48Accepted": false,
    "v171AcceptanceEstablished": false,
    "lifecyclePromotionEstablished": false,
    "consumerAcceptanceEstablished": false,
    "deploymentAcceptanceEstablished": false,
    "publicationEstablished": false,
    "productionAcceptanceEstablished": false
  },
  "boundary": "This plan establishes a fail-closed exact-source Energy evidence collection control for retained V1.7.1 energy-behavior. A structurally valid measurement remains review-required because GoreeCloud defines no numeric Energy acceptance threshold for this lane. Governed review must assess direct quantitative energy/power observations, thermal/resource recovery, background/off-screen behavior, task integrity, and authority preservation against applicable standards. The separate Device evidence group remains independently required. CI, templates, battery percentage alone, thermal state alone, CPU/GPU utilization alone, emulators, and invented thresholds are not Energy evidence."
}
